{
  "id": "2S-B1-PDA03-S1",
  "grado": "2°",
  "trimestre": "1",
  "numero": 15,
  "campoFormativo": "Saberes y Pensamiento Científico",
  "eje": "Sentido numérico y pensamiento algebraico",
  "titulo": "¿Qué es la proporcionalidad directa?",
  "contenido": "Resolución de problemas de proporcionalidad directa.",
  "pda": "Resuelve problemas de proporcionalidad directa mediante el valor unitario, la constante de proporcionalidad y otros procedimientos.",
  "problematizacion": {
    "contexto": "En la papelería de la escuela, el encargado te dice que si compras el doble de cuadernos pagas el doble, y si compras la mitad pagas la mitad. Un compañero no entiende por qué eso no pasa igual con la renta mensual del salón de usos múltiples, que se paga igual sin importar cuántas veces lo uses ese mes.",
    "pregunta": "¿Por qué el precio de los cuadernos sí es directamente proporcional a la cantidad comprada, pero la renta del salón no lo es?"
  },
  "subtemas": [
    {
      "numero": "3.1",
      "titulo": "¿Qué es la proporcionalidad directa?",
      "explicacion": "Dos cantidades son directamente proporcionales cuando, al multiplicar o dividir una de ellas por un número, la otra queda multiplicada o dividida por ese mismo número. Es decir, su razón (cociente) se mantiene constante. En la vida diaria aparece en el precio según la cantidad, el tiempo de recorrido a velocidad constante según la distancia, o los ingredientes de una receta según el número de porciones.",
      "formula": "y = k · x",
      "ejemplos": [
        "Si 2 boletos de camión cuestan $30, entonces 4 boletos (el doble de boletos) cuestan $60 (el doble de precio): la razón se mantiene.",
        "En la cooperativa, 4 paquetes de galletas cuestan $60. Si compras el doble de paquetes (8), pagarás el doble: $120."
      ],
      "puntosPorReactivo": 10,
      "estrellasMax": 3,
      "reactivos": [
        {
          "tipo": "verdadero_falso",
          "enunciado": "Si 6 boletos de autobús cuestan $90, entonces 10 boletos cuestan $150.",
          "respuestaCorrecta": true,
          "retroalimentacion": "Correcto: k = 90÷6 = 15 por boleto; 10×15 = $150."
        },
        {
          "tipo": "verdadero_falso",
          "enunciado": "Si 5 kg de manzanas cuestan $285, entonces 4 kg de manzanas cuestan $228.",
          "respuestaCorrecta": true,
          "retroalimentacion": "k = 285÷5 = 57. 4×57 = $228."
        },
        {
          "tipo": "verdadero_falso",
          "enunciado": "Si 4 plumas cuestan $220, entonces 3 plumas cuestan $165.",
          "respuestaCorrecta": true,
          "retroalimentacion": "k = 220÷4 = 55. 3×55 = $165."
        },
        {
          "tipo": "verdadero_falso",
          "enunciado": "Si 5 kg de manzanas cuestan $150, entonces 6 kg de manzanas cuestan $185.",
          "respuestaCorrecta": false,
          "retroalimentacion": "k = 150÷5 = 30. 6×30 = $180."
        },
        {
          "tipo": "verdadero_falso",
          "enunciado": "Si 10 cuadernos cuestan $540, entonces 3 cuadernos cuestan $162.",
          "respuestaCorrecta": true,
          "retroalimentacion": "k = 540÷10 = 54. 3×54 = $162."
        }
      ],
      "nivelEtiqueta": "Nivel 1 de 4 · Introductorio"
    }
  ]
}