{
  "id": "2S-B1-PDA03-S7",
  "grado": "2°",
  "trimestre": "1",
  "numero": 21,
  "campoFormativo": "Saberes y Pensamiento Científico",
  "eje": "Sentido numérico y pensamiento algebraico",
  "titulo": "Repaso integral: proporcionalidad directa",
  "contenido": "Resolución de problemas de proporcionalidad directa.",
  "pda": "Resuelve problemas de proporcionalidad directa mediante el valor unitario, la constante de proporcionalidad y otros procedimientos.",
  "problematizacion": {
    "contexto": "Para el viaje de generación, la mesa de padres de familia consiguió que un paquete de 4 gorras conmemorativas cueste $52, y ahora necesitan cotizar cuánto costarán 9 gorras más para que alcancen para todo el grupo.",
    "pregunta": "¿Cuánto costarán las 9 gorras adicionales, usando la misma constante de proporcionalidad del paquete original?"
  },
  "subtemas": [
    {
      "numero": "3.7",
      "titulo": "Repaso integral: proporcionalidad directa",
      "explicacion": "Recuerda: dos cantidades son directamente proporcionales cuando su razón se mantiene constante (k = y ÷ x). Para resolver cualquier problema, calcula k con un par de datos conocidos y multiplica por el valor que buscas: y = k × x. Esto aplica a precios, tiempos, recetas y muchas otras situaciones de la vida diaria.",
      "ejemplos": [
        "Si 4 boletos de camión cuestan $52, k = 52÷4 = 13 por boleto; para 9 boletos: 9×13 = $117."
      ],
      "puntosPorReactivo": 10,
      "estrellasMax": 3,
      "reactivos": [
        {
          "tipo": "llenar_frase",
          "frase": "Si 4 boletos de camión cuestan $52, entonces 9 boletos cuestan $___.",
          "respuestaCorrecta": "117",
          "retroalimentacion": "k = 52÷4 = 13 por boleto. 9×13 = $117."
        },
        {
          "tipo": "verdadero_falso",
          "enunciado": "Si 15 kg de naranjas cuestan $225, entonces 8 kg cuestan $120.",
          "respuestaCorrecta": true,
          "retroalimentacion": "Correcto: k = 225÷15 = 15 por kg; 8×15 = $120."
        },
        {
          "tipo": "opcion_multiple",
          "pregunta": "Si 6 entradas al cine cuestan $270, ¿cuánto cuestan 11 entradas?",
          "opciones": [
            "$450",
            "$495",
            "$460",
            "$405"
          ],
          "respuestaCorrecta": 1,
          "retroalimentacion": "k = 270÷6 = 45 por entrada. 11×45 = $495."
        },
        {
          "tipo": "verdadero_falso",
          "enunciado": "Una receta usa 4 tazas de harina para 24 galletas. Para 36 galletas se necesitan 6 tazas.",
          "respuestaCorrecta": true,
          "retroalimentacion": "Correcto: k = 4÷24 = 1/6 de taza por galleta; 36×1/6 = 6 tazas."
        },
        {
          "tipo": "relacionar_columnas",
          "instruccion": "Relaciona cada situación con su constante de proporcionalidad (k).",
          "columnaA": [
            "9 panes cuestan $63",
            "5 boletos de camión cuestan $65",
            "3 kg de plátano cuestan $51"
          ],
          "columnaB": [
            "$13 por boleto",
            "$17 por kg",
            "$7 por pan"
          ],
          "parejasCorrectas": [
            2,
            0,
            1
          ],
          "retroalimentacion": "9 panes cuestan $63 → $7 por pan; 5 boletos de camión cuestan $65 → $13 por boleto; 3 kg de plátano cuestan $51 → $17 por kg."
        }
      ],
      "nivelEtiqueta": "Repaso 3 de 3"
    }
  ],
  "practicaExtra": [
    {
      "tipo": "llenar_frase",
      "frase": "Si 4 kg de arroz cuestan $88, entonces 7 kg cuestan $___.",
      "respuestaCorrecta": "154",
      "retroalimentacion": "k = 88÷4 = 22 por kg. 7×22 = $154."
    },
    {
      "tipo": "opcion_multiple",
      "pregunta": "Una receta usa 3 tazas de harina para 18 galletas. ¿Cuántas tazas se necesitan para 30 galletas?",
      "opciones": [
        "4 tazas",
        "5 tazas",
        "6 tazas",
        "9 tazas"
      ],
      "respuestaCorrecta": 1,
      "retroalimentacion": "k = 3÷18 = 1/6 de taza por galleta. 30 × 1/6 = 5 tazas."
    },
    {
      "tipo": "verdadero_falso",
      "enunciado": "Un auto que recorre 150 km con 10 litros de gasolina recorrerá 225 km con 15 litros, manteniendo el mismo rendimiento.",
      "respuestaCorrecta": true,
      "retroalimentacion": "Correcto: k = 150÷10 = 15 km por litro. 15×15 = 225 km."
    },
    {
      "tipo": "relacionar_columnas",
      "instruccion": "Relaciona cada situación con su constante de proporcionalidad (k).",
      "columnaA": [
        "7 plumas cuestan $63",
        "9 litros de leche cuestan $153",
        "4 horas de clase cuestan $260"
      ],
      "columnaB": [
        "$65 por hora",
        "$9 por pluma",
        "$17 por litro"
      ],
      "parejasCorrectas": [
        1,
        2,
        0
      ],
      "retroalimentacion": "k = 63÷7 = $9 por pluma; k = 153÷9 = $17 por litro; k = 260÷4 = $65 por hora."
    }
  ]
}