{
  "id": "1S-B1-PDA06",
  "grado": "1°",
  "trimestre": "1",
  "numero": 6,
  "campoFormativo": "Saberes y Pensamiento Científico",
  "eje": "Sentido numérico y pensamiento algebraico",
  "titulo": "Encuentra el valor desconocido",
  "contenido": "Ecuaciones lineales y cuadráticas.",
  "pda": "Resuelve ecuaciones de la forma Ax=B, Ax+B=C, Ax+B=Cx+D con el uso de las propiedades de la igualdad.",
  "problematizacion": {
    "contexto": "Ana tenía algo de dinero ahorrado. Su tía le regaló $150, y ahora en total tiene $430.",
    "pregunta": "¿Cuánto dinero tenía Ana ahorrado antes del regalo?"
  },
  "subtemas": [
    {
      "numero": "6.1",
      "titulo": "¿Qué es una ecuación?",
      "explicacion": "Una ecuación es una igualdad con una incógnita. Para resolverla, se aplican las propiedades de la igualdad: lo que se hace de un lado de la igualdad se debe hacer también del otro, para 'despejar' la variable.",
      "ejemplos": [
        "5x = 45: para despejar x, se divide ambos lados entre 5: x = 45 ÷ 5 = 9."
      ],
      "puntosPorReactivo": 10,
      "estrellasMax": 3,
      "reactivos": [
        {
          "tipo": "verdadero_falso",
          "enunciado": "La solución de 4x - 5 = 11 es x = 4.",
          "respuestaCorrecta": true,
          "retroalimentacion": "Correcto: 4x = 11+5=16; x=16÷4=4."
        },
        {
          "tipo": "verdadero_falso",
          "enunciado": "La solución de 3x + 7 = 2x + 12 es x = 3.",
          "respuestaCorrecta": false,
          "retroalimentacion": "(3-2)x = 12-7 → x = 5."
        },
        {
          "tipo": "verdadero_falso",
          "enunciado": "La solución de 7x - 3 = 4x + 9 es x = 2.",
          "respuestaCorrecta": false,
          "retroalimentacion": "(7-4)x = 9--3 → x = 4."
        },
        {
          "tipo": "verdadero_falso",
          "enunciado": "La solución de 5x - 5 = 2x + 28 es x = 11.",
          "respuestaCorrecta": true,
          "retroalimentacion": "(5-2)x = 28--5 → x = 11."
        },
        {
          "tipo": "verdadero_falso",
          "enunciado": "La solución de 4x + 6 = 3x + 18 es x = 12.",
          "respuestaCorrecta": true,
          "retroalimentacion": "(4-3)x = 18-6 → x = 12."
        }
      ]
    },
    {
      "numero": "6.2",
      "titulo": "Ecuaciones de la forma Ax + B = C",
      "explicacion": "Cuando la ecuación tiene un término que se suma o resta además del que multiplica a x, primero se despeja ese término (pasándolo al otro lado con la operación inversa) y después se despeja x dividiendo.",
      "formula": "Ax + B = C  →  x = (C − B) / A",
      "ejemplos": [
        "x + 150 = 430  →  x = 430 − 150 = 280. Ana tenía $280 ahorrados.",
        "3x + 4 = 19  →  3x = 19-4=15  →  x=15÷3=5."
      ],
      "puntosPorReactivo": 10,
      "estrellasMax": 3,
      "reactivos": [
        {
          "tipo": "llenar_frase",
          "frase": "Resuelve: 2x + 3 = x + 10. x = ___.",
          "respuestaCorrecta": "7",
          "retroalimentacion": "2x - x = 10 - 3 → x = 7."
        },
        {
          "tipo": "llenar_frase",
          "frase": "Resuelve: 9x + 7 = 16. x = ___.",
          "respuestaCorrecta": "1",
          "retroalimentacion": "9x = 16-7 = 9; x = 9÷9 = 1."
        },
        {
          "tipo": "llenar_frase",
          "frase": "Resuelve: 9x - 2 = 7. x = ___.",
          "respuestaCorrecta": "1",
          "retroalimentacion": "9x = 7+2 = 9; x = 9÷9 = 1."
        },
        {
          "tipo": "llenar_frase",
          "frase": "Resuelve: 3x + 5 = 17. x = ___.",
          "respuestaCorrecta": "4",
          "retroalimentacion": "3x = 17-5 = 12; x = 12÷3 = 4."
        },
        {
          "tipo": "llenar_frase",
          "frase": "Resuelve: 7x + 4 = 53. x = ___.",
          "respuestaCorrecta": "7",
          "retroalimentacion": "7x = 53-4 = 49; x = 49÷7 = 7."
        }
      ]
    },
    {
      "numero": "6.3",
      "titulo": "Ecuaciones con la variable en ambos lados",
      "explicacion": "Cuando la variable aparece en ambos lados de la igualdad (Ax+B=Cx+D), primero se agrupan los términos con x de un lado y los términos numéricos del otro, y después se despeja x.",
      "ejemplos": [
        "2x + 3 = x + 10  →  2x - x = 10 - 3  →  x = 7."
      ],
      "puntosPorReactivo": 10,
      "estrellasMax": 3,
      "reactivos": [
        {
          "tipo": "opcion_multiple",
          "pregunta": "Resuelve: 3x + 4 = 19",
          "opciones": [
            "x=5",
            "x=6.33",
            "x=7.67",
            "x=15"
          ],
          "respuestaCorrecta": 0,
          "retroalimentacion": "3x = 19-4=15; x=15÷3=5."
        },
        {
          "tipo": "opcion_multiple",
          "pregunta": "Resuelve: 3x - 2 = 2x + 6",
          "opciones": [
            "x=4",
            "x=8",
            "x=-8",
            "x=1.6"
          ],
          "respuestaCorrecta": 1,
          "retroalimentacion": "3x - 2x = 6 + 2 → x = 8."
        },
        {
          "tipo": "opcion_multiple",
          "pregunta": "Resuelve: 6x - 3 = 69",
          "opciones": [
            "x=11",
            "x=15",
            "x=13",
            "x=12"
          ],
          "respuestaCorrecta": 3,
          "retroalimentacion": "6x = 72; x = 72÷6 = 12."
        },
        {
          "tipo": "opcion_multiple",
          "pregunta": "Resuelve: 4x + 1 = 21",
          "opciones": [
            "x=6",
            "x=5",
            "x=2",
            "x=4"
          ],
          "respuestaCorrecta": 1,
          "retroalimentacion": "4x = 20; x = 20÷4 = 5."
        },
        {
          "tipo": "opcion_multiple",
          "pregunta": "Resuelve: 4x + 3 = 15",
          "opciones": [
            "x=6",
            "x=3",
            "x=1",
            "x=2"
          ],
          "respuestaCorrecta": 1,
          "retroalimentacion": "4x = 12; x = 12÷4 = 3."
        }
      ]
    },
    {
      "numero": "6.4",
      "titulo": "Síntesis y aplicación",
      "explicacion": "Recuerda: una ecuación es una igualdad con una incógnita, y para resolverla aplicas la misma operación en ambos lados hasta despejar la variable. Si la x aparece en los dos lados de la igualdad, primero agrupa los términos con x de un lado y los números del otro, y después despeja.",
      "ejemplos": [
        "La solución de 4x - 5 = 11 es x = 4. Correcto: 4x = 11+5=16; x=16÷4=4."
      ],
      "puntosPorReactivo": 10,
      "estrellasMax": 3,
      "reactivos": [
        {
          "tipo": "opcion_multiple",
          "pregunta": "Resuelve: 6x + 4 = 52",
          "opciones": [
            "x=7",
            "x=8",
            "x=6",
            "x=9"
          ],
          "respuestaCorrecta": 1,
          "retroalimentacion": "6x = 48; x = 48÷6 = 8."
        },
        {
          "tipo": "relacionar_columnas",
          "instruccion": "Relaciona cada ecuación con su solución.",
          "columnaA": [
            "5x = 45",
            "x + 150 = 430",
            "2x + 3 = x + 10"
          ],
          "columnaB": [
            "280",
            "7",
            "9"
          ],
          "parejasCorrectas": [
            2,
            0,
            1
          ],
          "retroalimentacion": "5x=45 → x=9; x+150=430 → x=280; 2x+3=x+10 → x=7."
        },
        {
          "tipo": "relacionar_columnas",
          "instruccion": "Relaciona cada ecuación con su solución.",
          "columnaA": [
            "3x + 7 = 46",
            "9x + 6 = 78",
            "5x - 10 = 35"
          ],
          "columnaB": [
            "x=8",
            "x=9",
            "x=13"
          ],
          "parejasCorrectas": [
            2,
            0,
            1
          ],
          "retroalimentacion": "3x + 7 = 46 → x=13; 9x + 6 = 78 → x=8; 5x - 10 = 35 → x=9."
        },
        {
          "tipo": "relacionar_columnas",
          "instruccion": "Relaciona cada ecuación con su solución.",
          "columnaA": [
            "8x + 1 = 17",
            "5x - 1 = 64",
            "6x - 2 = 64"
          ],
          "columnaB": [
            "x=11",
            "x=13",
            "x=2"
          ],
          "parejasCorrectas": [
            2,
            1,
            0
          ],
          "retroalimentacion": "8x + 1 = 17 → x=2; 5x - 1 = 64 → x=13; 6x - 2 = 64 → x=11."
        },
        {
          "tipo": "relacionar_columnas",
          "instruccion": "Relaciona cada ecuación con su solución.",
          "columnaA": [
            "9x + 3 = 12",
            "5x - 1 = 9",
            "6x - 9 = 75"
          ],
          "columnaB": [
            "x=14",
            "x=1",
            "x=2"
          ],
          "parejasCorrectas": [
            1,
            2,
            0
          ],
          "retroalimentacion": "9x + 3 = 12 → x=1; 5x - 1 = 9 → x=2; 6x - 9 = 75 → x=14."
        }
      ]
    }
  ],
  "practicaExtra": [
    {
      "tipo": "llenar_frase",
      "frase": "Resuelve: 7x = 63. x = ___.",
      "respuestaCorrecta": "9",
      "retroalimentacion": "x = 63 ÷ 7 = 9."
    },
    {
      "tipo": "opcion_multiple",
      "pregunta": "Resuelve: x - 25 = 40",
      "opciones": [
        "x=15",
        "x=65",
        "x=-15",
        "x=1000"
      ],
      "respuestaCorrecta": 1,
      "retroalimentacion": "x = 40 + 25 = 65."
    },
    {
      "tipo": "verdadero_falso",
      "enunciado": "La solución de 5x + 10 = 3x + 24 es x = 7.",
      "respuestaCorrecta": true,
      "retroalimentacion": "Correcto: 5x - 3x = 24 - 10 → 2x = 14 → x = 7."
    },
    {
      "tipo": "relacionar_columnas",
      "instruccion": "Relaciona cada ecuación con su solución.",
      "columnaA": [
        "4x - 5 = 11",
        "3x - 2 = 2x + 6",
        "x - 25 = 40"
      ],
      "columnaB": [
        "8",
        "65",
        "4"
      ],
      "parejasCorrectas": [
        2,
        0,
        1
      ],
      "retroalimentacion": "4x-5=11 → x=4; 3x-2=2x+6 → x=8; x-25=40 → x=65."
    }
  ]
}
