{
  "id": "1S-B1-PDA04-S7",
  "grado": "1°",
  "trimestre": "1",
  "numero": 28,
  "campoFormativo": "Saberes y Pensamiento Científico",
  "eje": "Sentido numérico y pensamiento algebraico",
  "titulo": "Repaso integral: sucesiones con progresion aritmetica",
  "contenido": "Regularidades y Patrones.",
  "pda": "Representa algebraicamente una sucesión con progresión aritmética de figuras y números.",
  "problematizacion": {
    "contexto": "El club de ajedrez ordena las mesas del torneo en filas dentro del salón: comienzan con 3 mesas en la fila del frente y en cada fila hacia atrás caben 2 mesas de más.",
    "pregunta": "Identificando la diferencia constante y aplicando la fórmula del término n, ¿cuántas mesas habrá en la fila 15?"
  },
  "subtemas": [
    {
      "numero": "4.7",
      "titulo": "Repaso integral: sucesiones con progresion aritmetica",
      "explicacion": "Recuerda: una sucesion tiene progresion aritmetica cuando la diferencia d entre terminos consecutivos siempre es la misma. La formula termino_n = a + (n-1) x d funciona tanto para sucesiones de numeros como para sucesiones de figuras, y sirve para encontrar cualquier termino sin dibujar ni sumar uno por uno.",
      "ejemplos": [
        "Con a=7 y d=6, el termino 5 de una sucesion de palillos es 7 + (5-1)x6 = 7+24 = 31 palillos."
      ],
      "puntosPorReactivo": 10,
      "estrellasMax": 3,
      "reactivos": [
        {
          "tipo": "verdadero_falso",
          "enunciado": "En la sucesion con a=11 y d=-3, el termino 6 es -4.",
          "respuestaCorrecta": true,
          "retroalimentacion": "termino_6 = 11 + (6-1)x-3 = 11-15 = -4."
        },
        {
          "tipo": "llenar_frase",
          "frase": "Con a=9 y d=6, el termino 5 de la sucesion es ___.",
          "respuestaCorrecta": "33",
          "retroalimentacion": "termino_5 = 9 + (5-1)x6 = 9+24 = 33."
        },
        {
          "tipo": "opcion_multiple",
          "pregunta": "Una sucesion de figuras con palillos empieza en 7 palillos y aumenta 6 en cada figura. ¿Cuantos palillos tiene la figura 5?",
          "opciones": [
            "25",
            "31",
            "37",
            "28"
          ],
          "respuestaCorrecta": 1,
          "retroalimentacion": "a=7, d=6. termino_5 = 7 + (5-1)x6 = 7+24 = 31."
        },
        {
          "tipo": "relacionar_columnas",
          "instruccion": "Relaciona cada sucesion (dado a y d) con el valor del termino indicado.",
          "columnaA": [
            "a=6, d=3 -> termino 5",
            "a=15, d=-4 -> termino 4",
            "a=1, d=4 -> termino 6"
          ],
          "columnaB": [
            "3",
            "21",
            "18"
          ],
          "parejasCorrectas": [
            2,
            0,
            1
          ],
          "retroalimentacion": "a=6,d=3: termino_5=6+4x3=18. a=15,d=-4: termino_4=15+3x-4=3. a=1,d=4: termino_6=1+5x4=21."
        },
        {
          "tipo": "relacionar_columnas",
          "instruccion": "Relaciona cada sucesion (dado a y d) con el valor del termino indicado.",
          "columnaA": [
            "a=4, d=-2 -> termino 5",
            "a=2, d=3 -> termino 4",
            "a=13, d=-3 -> termino 3"
          ],
          "columnaB": [
            "11",
            "7",
            "-4"
          ],
          "parejasCorrectas": [
            2,
            0,
            1
          ],
          "retroalimentacion": "a=4,d=-2: termino_5=4+4x-2=-4. a=2,d=3: termino_4=2+3x3=11. a=13,d=-3: termino_3=13+2x-3=7."
        }
      ],
      "nivelEtiqueta": "Repaso 3 de 3"
    }
  ],
  "practicaExtra": [
    {
      "tipo": "llenar_frase",
      "frase": "Con a=3 y d=6, el término 5 de la sucesión es ___.",
      "respuestaCorrecta": "27",
      "retroalimentacion": "término_5 = 3 + (5-1)×6 = 3+24 = 27."
    },
    {
      "tipo": "opcion_multiple",
      "pregunta": "En la sucesión 10, 7, 4, 1..., ¿cuál es la diferencia constante d?",
      "opciones": [
        "-3",
        "3",
        "-7",
        "4"
      ],
      "respuestaCorrecta": 0,
      "retroalimentacion": "Cada término disminuye 3 respecto al anterior: 7-10=-3."
    },
    {
      "tipo": "verdadero_falso",
      "enunciado": "En la sucesión 2, 5, 8, 11..., el término 6 es 17.",
      "respuestaCorrecta": true,
      "retroalimentacion": "Correcto: a=2, d=3. término_6 = 2 + (6-1)×3 = 2+15 = 17."
    },
    {
      "tipo": "relacionar_columnas",
      "instruccion": "Relaciona cada sucesión (dado a y d) con el término indicado.",
      "columnaA": [
        "a=5, d=2 → término 4",
        "a=20, d=-5 → término 3",
        "a=0, d=8 → término 5"
      ],
      "columnaB": [
        "10",
        "32",
        "11"
      ],
      "parejasCorrectas": [
        2,
        0,
        1
      ],
      "retroalimentacion": "a=5,d=2,n=4: 5+3×2=11. a=20,d=-5,n=3: 20+2×(-5)=10. a=0,d=8,n=5: 0+4×8=32."
    }
  ]
}