{
  "id": "2S-B1-PDA04-S5",
  "grado": "2°",
  "trimestre": "1",
  "numero": 26,
  "campoFormativo": "Saberes y Pensamiento Científico",
  "eje": "Sentido numérico y pensamiento algebraico",
  "titulo": "Repaso: qué es una progresión cuadrática y sus coeficientes",
  "contenido": "Regularidades y Patrones.",
  "pda": "Representa algebraicamente una sucesión con progresión cuadrática de figuras y números.",
  "problematizacion": {
    "contexto": "En la tiendita escolar, cada semana el encargado arma con paquetes de galletas una pirámide cuadrada para la vitrina: la semana 1 usa 1 paquete, la semana 2 usa 4, la semana 3 usa 9... y en la sucursal de junto arman lo mismo pero con el triple de paquetes por espacio.",
    "pregunta": "¿Cuántos paquetes necesita cada tiendita en la semana 5 si una sigue el patrón n² y la otra sigue 3n²?"
  },
  "subtemas": [
    {
      "numero": "4.5",
      "titulo": "Repaso: qué es una progresión cuadrática y sus coeficientes",
      "explicacion": "Recuerda: en una progresión cuadrática cada término se relaciona con el cuadrado de su posición (n²): 1, 4, 9, 16... Si la sucesión tiene un coeficiente, como 2n² o 3n², cada término es ese múltiplo del cuadrado de la posición. Para encontrar cualquier término solo sustituyes el valor de n en la expresión.",
      "ejemplos": [
        "El término 10 de la sucesión n² es 10²=100.",
        "El término 5 de la sucesión 3n² es 3×5²=3×25=75."
      ],
      "puntosPorReactivo": 10,
      "estrellasMax": 3,
      "reactivos": [
        {
          "tipo": "verdadero_falso",
          "enunciado": "El término 10 de la sucesión n² es 100.",
          "respuestaCorrecta": true,
          "retroalimentacion": "Correcto: 10² = 100."
        },
        {
          "tipo": "verdadero_falso",
          "enunciado": "El término 5 de la sucesión 3n² es 75.",
          "respuestaCorrecta": true,
          "retroalimentacion": "3n² en n=5: 3×5² = 3×25 = 75."
        },
        {
          "tipo": "llenar_frase",
          "frase": "En la sucesión n²-1, el término 7 es ___.",
          "respuestaCorrecta": "48",
          "retroalimentacion": "n²-1 en n=7: 7²-1 = 49-1 = 48."
        },
        {
          "tipo": "llenar_frase",
          "frase": "En la sucesión 2n², el término 9 es ___.",
          "respuestaCorrecta": "162",
          "retroalimentacion": "2n² en n=9: 2×9² = 2×81 = 162."
        },
        {
          "tipo": "opcion_multiple",
          "pregunta": "¿Qué expresión algebraica representa la sucesión 2, 8, 18, 32...?",
          "opciones": [
            "n²",
            "2n²",
            "n²+2",
            "3n²"
          ],
          "respuestaCorrecta": 1,
          "retroalimentacion": "2n²: 2(1)²=2, 2(2)²=8, 2(3)²=18, 2(4)²=32. Coincide con la sucesión."
        }
      ],
      "nivelEtiqueta": "Repaso 1 de 3"
    }
  ]
}