{
  "id": "1S-B1-PDA02-S7",
  "grado": "1°",
  "trimestre": "1",
  "numero": 14,
  "campoFormativo": "Saberes y Pensamiento Científico",
  "eje": "Sentido numérico y pensamiento algebraico",
  "titulo": "Repaso integral: comparar y ordenar números con signo",
  "contenido": "Extensión de los números a positivos y negativos y su orden.",
  "pda": "Reconoce la necesidad de los números negativos a partir de usar cantidades que tienen al cero como referencia. Compara y ordena números con signo en la recta numérica.",
  "problematizacion": {
    "contexto": "En el reporte de una expedición se mencionan cuatro posiciones tomando como referencia el nivel del suelo (cero): un elevador subterráneo en -12, un dron en +30, una cueva en -25 y un mirador en +8.",
    "pregunta": "Ordenando las cuatro posiciones de la más baja a la más alta respecto al nivel del suelo, ¿cuál quedaría primero y cuál al final?"
  },
  "subtemas": [
    {
      "numero": "2.7",
      "titulo": "Repaso integral: comparar y ordenar números con signo",
      "explicacion": "Recuerda: en la recta numérica el número mayor está siempre más a la derecha; entre dos negativos, el menos negativo (más cercano al cero) es el mayor. Para comparar distancias al cero (como profundidades y alturas), fíjate en el valor absoluto: el número más lejano del cero, sin importar el signo, es el que está 'más lejos' de la referencia.",
      "ejemplos": [
        "Entre -22, -19, -25 y -30, el mayor es -19 porque es el menos negativo.",
        "Un dron a 12 m y un buzo a -27 m: el dron está más cerca del nivel del mar (0) porque 12 < 27."
      ],
      "puntosPorReactivo": 10,
      "estrellasMax": 3,
      "reactivos": [
        {
          "tipo": "verdadero_falso",
          "enunciado": "-17 es menor que -11.",
          "respuestaCorrecta": true,
          "retroalimentacion": "Correcto: -17 < -11, porque -17 está más a la izquierda en la recta numérica."
        },
        {
          "tipo": "verdadero_falso",
          "enunciado": "La lista -2, 9, -15, 4 ordenada de mayor a menor queda: 9, 4, -2, -15.",
          "respuestaCorrecta": true,
          "retroalimentacion": "Correcto: de mayor a menor, 9 > 4 > -2 > -15."
        },
        {
          "tipo": "llenar_frase",
          "frase": "El número mayor entre -22, -19, -25, -30 es ___.",
          "respuestaCorrecta": "-19",
          "retroalimentacion": "Entre números negativos, el mayor es el que está más cerca del 0: -19 es el menos negativo, así que es el mayor."
        },
        {
          "tipo": "opcion_multiple",
          "pregunta": "Un dron vuela a 12 m y un buzo está a -27 m. ¿Cuál está más cerca del nivel del mar (del 0)?",
          "opciones": [
            "El dron",
            "El buzo",
            "Ambos están a la misma distancia",
            "No se puede saber"
          ],
          "respuestaCorrecta": 0,
          "retroalimentacion": "El dron está a 12 m del 0 y el buzo a 27 m; 12 es menor que 27, así que el dron está más cerca."
        },
        {
          "tipo": "relacionar_columnas",
          "instruccion": "Relaciona cada posición (respecto al nivel del mar) con su descripción.",
          "columnaA": [
            "-25 m",
            "10 m",
            "-3 m"
          ],
          "columnaB": [
            "Es la más profunda",
            "Es la más alta",
            "Es una posición intermedia"
          ],
          "parejasCorrectas": [
            0,
            1,
            2
          ],
          "retroalimentacion": "-25 m es la más profunda; -3 m es una posición intermedia; 10 m es la más alta."
        }
      ],
      "nivelEtiqueta": "Repaso 3 de 3"
    }
  ],
  "practicaExtra": [
    {
      "tipo": "verdadero_falso",
      "enunciado": "-15 es mayor que -20.",
      "respuestaCorrecta": true,
      "retroalimentacion": "Correcto: -15 está más a la derecha en la recta numérica que -20, así que -15 > -20."
    },
    {
      "tipo": "opcion_multiple",
      "pregunta": "Un dron vuela a 25 m y un buzo está a -10 m. ¿Cuál está más lejos del nivel del mar (0)?",
      "opciones": [
        "El dron (más lejos)",
        "El buzo (más lejos)",
        "Ambos están a la misma distancia",
        "No se puede saber"
      ],
      "respuestaCorrecta": 0,
      "retroalimentacion": "El dron está a 25 m de distancia del 0, y el buzo a 10 m; 25 es mayor que 10, así que el dron está más lejos."
    },
    {
      "tipo": "llenar_frase",
      "frase": "Ordenados de mayor a menor, el segundo número de la lista 6, -3, 0, -8 es ___.",
      "respuestaCorrecta": "0",
      "retroalimentacion": "De mayor a menor: 6, 0, -3, -8. El segundo lugar es el 0."
    },
    {
      "tipo": "relacionar_columnas",
      "instruccion": "Relaciona cada temperatura con su posición relativa entre las tres.",
      "columnaA": [
        "-12°C",
        "-1°C",
        "4°C"
      ],
      "columnaB": [
        "Es la más caliente",
        "Es templada, bajo cero",
        "Es la más fría"
      ],
      "parejasCorrectas": [
        2,
        1,
        0
      ],
      "retroalimentacion": "-12°C es la más fría; -1°C es templada bajo cero; 4°C es la más caliente."
    }
  ]
}